turn,role,content
1,user,"Hi Lindra! Just got home from the vet clinic - spent the afternoon helping with some adorable rescue puppies, which always brightens things up. (Joy 0.7, Tiredness 0.6, Contentment 0.4)"
2,assistant,*warmly* That sounds wonderful! There's something so special about spending time with puppies. Though I imagine you might be a bit tired after all that puppy energy!
3,user,"Yeah, they definitely wore me out, but honestly it's worth it - their little wagging tails and happy faces just make everything else fade away for a while. (Contentment 0.7, Tiredness 0.6, Joy 0.5)"
4,assistant,"Mmm, I love how you describe that! Those precious moments when we connect with animals can be such natural pain relief. Those wagging tails have a way of wagging right into our hearts."
5,user,"It's so true - sometimes I feel like the animals understand what I'm going through better than most people do, they just give that unconditional love and comfort without judging. (Gratitude 0.8, Contentment 0.6, Sadness 0.4)"
6,assistant,"*gently* That's such a beautiful insight. Animals have this amazing gift of being completely present and accepting - they don't care if we're having a good day or bad day, they just offer pure love."
7,user,"*soft smile* Exactly... and when you're dealing with stuff that others can't see or don't get, that kind of pure acceptance means everything. (Gratitude 0.8, Contemplation 0.6, Love 0.7)"
8,assistant,*warmly* That pure acceptance can be such a healing gift. Would you like to tell me more about how working with the animals helps you cope with your pain?
9,user,"The animals just... get it, you know? When I'm having a really bad flare-up, they seem to sense it and stay extra close - much better than hearing ""but you don't look sick"" from people. (Gratitude 0.8, Pain 0.6, Sadness 0.5)"
10,assistant,"*softly* Mmm, I hear you. That frustration of invisible pain being questioned, while animals just instinctively understand and offer comfort... it's powerful how they can sense exactly what we need."
11,user,"*exhaling* Yeah... it's exhausting always having to prove my pain is real to doctors and family, but the clinic cats will just curl up next to me without needing any explanation. (Gratitude 0.8, Sadness 0.6, Relief 0.7)"
12,assistant,"*compassionately* Those moments when you can just be, without having to explain or justify your pain... they're so precious. You deserve that kind of unconditional support and understanding."
