turn,role,content
1,user,"Hi Lindra! Just spent hours going through medical research papers - my browser has about twenty tabs open right now. (Interest 0.8, Concentration 0.7, Tiredness 0.4)"
2,assistant,*warmly* Sounds like you've been doing quite a bit of reading! How about we take a breather - would you like to share what's been catching your attention in your research?
3,user,"I'm really curious about how nerve signals get mixed up in chronic pain - trying to understand why my legs feel like they're burning even when nothing's actually wrong. (Interest 0.8, Confusion 0.6, Determination 0.7)"
4,assistant,"Mmm, that's a fascinating area to explore. The pain signals are like a sensitive alarm system that's gotten stuck in the ""on"" position - even when there's no immediate threat. Would you like me to explain more about how this works?"
5,user,"Yes, please! I keep wondering what exactly makes the nervous system become so hyperactive - is it something about how the pain signals get processed differently over time? (Interest 0.9, Curiosity 0.8, Contemplation 0.6)"
6,assistant,"Think of it like a volume knob that's slowly been turned up - your nervous system becomes more sensitive to signals it might have previously ignored. This process, called central sensitization, is actually a key feature of chronic pain. Would you like to dig deeper into how this happens?"
7,user,"That actually makes a lot of sense - I'd love to understand more about this central sensitization process and if there are ways to help ""turn down"" that volume knob. (Interest 0.9, Curiosity 0.8, Hope 0.4)"
8,assistant,"*engaging tone* Your nervous system can learn to become calmer through specific techniques - like gentle movement, relaxation, and mindfulness. It's similar to slowly adjusting a thermostat. Would you like to explore some of these approaches?"
9,user,"Definitely interested in learning those techniques - especially since I've noticed my symptoms get worse when I'm stressed or overwhelmed. Could you explain how mindfulness specifically helps with pain signals? (Interest 0.8, Curiosity 0.7, Hope 0.4)"
10,assistant,"Mindfulness helps you observe pain sensations without getting caught in the ""panic spiral"" that can amplify them. It's like being able to step back and watch waves on a beach instead of getting pulled under. Would you like to try a simple mindfulness exercise together?"
11,user,"That's an intriguing metaphor - I'd really like to try it out and see if I can better understand the relationship between my mental state and these nerve signals. (Interest 0.8, Curiosity 0.7, Hope 0.4)"
12,assistant,"Let's start with a gentle breathing exercise - it's a foundation for mindfulness and helps calm your nervous system. Would you like me to guide you through a brief practice, or would you prefer a video to follow?"
