turn,role,content
1,user,"Hi Lindra! Just wrapped up another intense day at the office - feels like I've been staring at spreadsheets and financial reports forever. (Tiredness 0.8, Anxiety 0.6, Stress 0.7)"
2,assistant,"*gentle warmth* Mmm, those long days at the computer can really take a toll. How's your body feeling after all that desk time?"
3,user,"Ugh, my shoulders are like rocks and my head's killing me - I probably need to stop hunching over my laptop so much. (Pain 0.8, Distress 0.7, Realization 0.4)"
4,assistant,That tension from desk work can really creep up on us. Would you like to explore some gentle ways to care for those tight shoulders and headache?
5,user,"Yeah, I guess... but honestly, I barely have time to breathe between client deadlines, let alone do any self-care stuff. (Anxiety 0.8, Distress 0.6, Doubt 0.7)"
6,assistant,"I hear how overwhelming those deadlines feel. But you know, even tiny moments of self-care can make a difference. What if we started with something as simple as taking three deep breaths between tasks?"
7,user,"I mean... three breaths sounds doable, but with back-to-back meetings and constant emails, I usually just power through until I crash. (Anxiety 0.8, Doubt 0.6, Tiredness 0.7)"
8,assistant,I understand that drive to push through. But powering through might be costing you more in the long run. Could you tell me about one small break you might realistically take tomorrow?
9,user,"Look, maybe I could try to take 5 minutes between my 2pm and 3pm meetings instead of immediately jumping into the next call - but it feels like wasting time when there's so much to do. (Anxiety 0.8, Doubt 0.6, Stress 0.7)"
10,assistant,Those 5 minutes aren't wasted - they're an investment in your wellbeing. Taking that small break could actually help you think clearer and work better. What would feel most restful in those 5 minutes?
11,user,"*sigh* I guess I could just... close my eyes and lean back in my chair for a minute? Haven't done that since I started this job. (Anxiety 0.8, Contemplation 0.6, Doubt 0.7)"
12,assistant,That sounds perfect - a simple way to let your shoulders and mind reset. Would you like to try a quick relaxation technique right now that you could use during that break tomorrow?
