turn,role,content
1,user,"Hi Lindra... I mostly just watched TV today and scrolled through old photos on my phone of when I used to go dancing with friends. (Nostalgia 0.8, Sadness 0.7, Loneliness 0.6)"
2,assistant,"Mmm, those memories of dancing with friends must hold special meaning for you. Would you like to tell me more about what dancing meant to you?"
3,user,"*hesitates* Dancing was... everything - the music, the movement, the laughter with friends... I miss feeling that free and connected. (Nostalgia 0.9, Sadness 0.8, Longing 0.7)"
4,assistant,"I hear such longing in your voice. That beautiful combination of movement, music, and friendship brought you real joy. It's natural to grieve those moments of freedom and connection."
5,user,"*quietly* Yeah... sometimes I wonder if I'll ever feel that kind of joy again - it feels like it belongs to a different person's life now. (Sadness 0.8, Nostalgia 0.7, Pain 0.6)"
6,assistant,That sense of loss feels so deep. But you're still that same vibrant person who loved to dance - even if your relationship with movement has had to change. What small ways might you reconnect with music or movement now?
7,user,"I... I don't know if I can - even swaying to music makes me worried I'll pay for it later... *voice getting smaller* Maybe just listening would be safer? (Anxiety 0.8, Fear 0.7, Nostalgia 0.5)"
8,assistant,Starting with just listening sounds like a gentle first step. Would you feel comfortable sharing one of your favorite dance songs? Sometimes reconnecting with the music itself can bring back a spark of that joy.
9,user,"Um... there was this one song - ""Dancing Queen"" by ABBA... *long pause* I used to play it for my kindergarten class during dance breaks... but I haven't listened to it in so long. (Nostalgia 0.8, Sadness 0.7, Fear 0.4)"
10,assistant,*warmly* Those memories of sharing music with your students sound precious. Would you like to try listening to Dancing Queen together right now? Just to enjoy the melody - no pressure to move at all.
11,user,"*nervously* I... I guess we could try... though it might make me emotional - I haven't heard it since I had to leave teaching. (Anxiety 0.8, Nostalgia 0.7, Fear 0.6)"
12,assistant,It's completely okay to feel emotional. Those feelings honor what teaching and dancing meant to you. I'm right here with you if you'd like to take this small step of just listening together.
