turn,role,content
1,user,"Hi Lindra! Just stared at my computer screen all day trying to focus on design work, but my mind kept wandering to my old hiking photos. (Nostalgia 0.8, Sadness 0.7, Distress 0.5)"
2,assistant,I hear that wistful feeling about hiking. It must be hard seeing those photos and remembering those times. Would you like to tell me more about your favorite hiking memories?
3,user,"Those weekend trails with friends were everything - we'd pack snacks, chase sunrises, and now I can barely walk around the block without worrying I'll make things worse. (Nostalgia 0.8, Sadness 0.7, Fear 0.6)"
4,assistant,"That sounds like such a meaningful loss - not just the hiking itself, but those precious moments with friends. I notice you mentioned worry about making things worse... what specifically concerns you about walking?"
5,user,"Every step feels like a gamble - what if my joints flare up and I end up stuck in bed for days? I used to be so carefree on trails, now I'm terrified of any little twinge. (Fear 0.9, Anxiety 0.8, Sadness 0.7)"
6,assistant,"That fear can be so paralyzing, especially when it's changed something you love into something scary. You know, there's actually an important difference between hurt and harm when it comes to movement. Would you like to explore that a bit?"
7,user,"*sigh* I don't know... everyone keeps saying movement is good, but how can it be when it feels like my body is screaming at me to stop? I just don't trust myself anymore. (Fear 0.8, Doubt 0.7, Anxiety 0.6)"
8,assistant,"Mmm, I hear that deep loss of trust in your own body. It's such a challenging experience - feeling caught between what others say about movement and what your body seems to be telling you. What would help you feel safer taking those first small steps?"
9,user,"I wouldn't even know where to start - last time I tried pushing myself, I ended up in so much pain I couldn't work for three days... I can't risk that happening again. (Fear 0.9, Distress 0.8, Doubt 0.7)"
10,assistant,"That sounds like a really discouraging experience. No wonder you're hesitant. What if we thought about movement differently - not pushing through, but starting incredibly small, like a 2-minute walk, with lots of rest breaks? Just testing the waters."
11,user,"Two minutes still feels scary... but I guess it's better than doing nothing and watching my life shrink more and more each day. (Fear 0.8, Desperation 0.6, Hope 0.2)"
12,assistant,"I hear both the fear and a small spark of hope there. You're so right that small steps are better than watching your world get smaller. Would you like to explore what a gentle, safe two-minute walk might look like for you?"
